title,author,ISBN,suggestor,details,Description,,,,,
Data feminism,Catherine D'Ignazio and Lauren F. Klein,,,,,,,,,
How Innovation Works,Matt Ridley,,,,,,,,,
Technology is Not Neutral - A Short Guide to Data Ethics, Stephanie Hare,,,,,,,,,
Sapiens: A Brief History of Humankind, Yuval Noah Harari, , Ebrahim Ghaderi, a healthcare scientist at Public Health Scotland," ""This is a twin recommendation for two books by Yuval Noah Harari", titled 'Sapiens: A Brief History of Humankind' and 'Homo Deus: A Brief History of Tomorrow,' are essential reading for healthcare personnel, as we can provide clearer insights into humanity, human behavior," interpretation of habits and the physical and mental health of community."""
Never Split The Difference, , , Brian Orpin, Project Office Team Manager at Public Health Scotland,"  ""Great book"" ",,,,,
